video_id,trending_date,title,channel_title,category_id,publish_time,tags,views,likes,dislikes,comment_count,thumbnail_link,comments_disabled,ratings_disabled,video_error_or_removed,description
ygniSAoGMgA,17.15.11,난이도▲▲ 제시어가 추가된 무궁화 꽃이 피었습니다 !! [웃소 Wootso],웃소 Wootso,23,2017-11-14T11:38:27.000Z,"웃음코뿔소|""웃소""|""wootso""|""유형별""|""아이러브니키""|""그림""|""릴레이그림""|""공감""|""아이스크림""|""웃소 게임""|""웃소 무궁화""|""무궁화 꽃이 피었습니다""|""웃소 술래잡기""|""웃소 좀비""|""좀비 술래잡기""|""엠티 게임""|""엠티 장기자랑""|""엠티 노래""|""엠티 메이크업""",40825,1272,13,284,https://i.ytimg.com/vi/ygniSAoGMgA/default.jpg,FALSE,FALSE,FALSE,"작년 이맘때 놀러 와서 좀비 술래잡기를 한 펜션에 다시 왔어요 !\n이번엔 업그레이드 무궁화 꽃이 피었습니다를 해봤습니다 ㅋㅋㅋㅋ\n\n화/금을 웃소와 함께! ▶ https://goo.gl/UnQQTU\n웃소 굿즈를 사고 영혼을 공유하자!! ▶http://wootsoshop.com/\n\n[웃소는?!]\n웃소 채널은 함께 공감할 수 있는 유형별 공감 영상, 보드게임을 비롯한 다양한 게임 및 챌린지 등 함께 모여 왁자지껄 떠들며 즐기는 모든 웃음을 영상으로 담습니다! 뚜루뚯뚯 뚜뚜뚜루루~ 우~웃소!\n \n[웃소 업로드 일정]\n매주 화요일/금요일 여덟시에 여러분 폰 안으로 찾아갑니다~ 알람설정 꾹!\n\n[웃소 멤버들과 멤버들 유튜브 채널]\n고탱 : http://youtube.com/gotengvideo\n디투 : http://youtube.com/d2monstar\n선바 : http://youtube.com/sunbaaking\n성희 : https://goo.gl/adkpRd\n우디 : http://www.youtube.com/SuperHDzzz\n태훈: https://www.youtube.com/channel/UCydpPyWKFJi3ljDX-4coz7Q\n해리 \n\n\n웃소 Wootso\n홈페이지 http://wootso.com\n페이스북 http://facebook.com/wootsoteam\n인스타그램 http://instagram.com/wootso\n\n우편사서함 PO BOX\n서울특별시 금천구 시흥대로 269, 904호"
L6RgYEvnUBA,17.15.11,2017년11월14일 아침 뉴스,Kim Sinh,25,2017-11-13T15:23:25.000Z,"자유한국당|""류여해""|""미군철수""|""트럼프""|""미국""|""중국""|""시진핑""|""아베""|""일본""|""선제타격""|""전쟁""|""icbm""|""slbm""|""미사일""|""핵실험""|""핵개발""|""전술핵""|""재배치""|""국민의당""|""안철수""|""유승민""|""심상정""|""김문수""|""김기춘""|""조윤선""|""정유라""|""최순실""|""박근혜""|""박정희""|""유영하""|""이재용""|""이재명""|""김사랑""|""김정은""|""노조""|""집회""|""태극기""|""김정민""|""거짓말""|""동문서답""|""대선""|""토론""|""관훈""|""사드""|""오바마""|""힐러리""|""탁현민""|""임종석""|""조국""|""유병언""|""세월호""|""저축은행""|""전희경""|""민경욱""|""조원진""|""변희재""|""정미홍""|""대한애국당""|""새누리당""|""독도""|""이명박""|""원세훈""|""국정원""|""댓글""|""김규리""|""택시운전사""|""틸러슨""|""국무장관""|""목함지뢰""|""최태민""|""진주의료원""|""민주노총""|""김장겸""|""고대영""|""고영주""|""배현진""|""신동호""|""전두환""|""518""|""정규재""|""신의한수""|""출당""|""탄핵""|""재판""|""구속""|""삼성""|""바른정당""|""홍준표""",140194,504,110,351,https://i.ytimg.com/vi/L6RgYEvnUBA/default.jpg,FALSE,FALSE,FALSE,2017년11월14일 아침 뉴스
Ic_nGV-cDrI,17.15.11,베이블레이드 버스트 갓 33화 쉘터 레굴루스vs아크 바하무트,언지t v,22,2017-11-13T23:26:07.000Z,[none],17380,84,5,32,https://i.ytimg.com/vi/Ic_nGV-cDrI/default.jpg,FALSE,FALSE,FALSE,출처=openload
fj8Ul67aLgc,17.15.11,[성수커플] 잔소리 많이 하는 성현이를 조용히 만드는 방법! (ENG SUB) The way of making nagging BF to be quiet!,성수커플 - S.S Couple,23,2017-11-14T10:00:03.000Z,"이성현|""이수은""|""이성현 여자친구""|""난쟁이성현 여자친구""|""난쟁이수은""|""난쟁이성현""|""Vlog""|""데이트""|""Date""|""Couple""|""커플""|""달달한 영상""|""커플 영상""|""Couple Date""|""커플 데이트""|""커플 데이트 코스""|""데이트 코스 추천""|""커플 데이트 장소""|""커플 놀러갈만한 곳""|""놀러갈만한 곳""|""커플 놀만한 곳""|""비글남친""|""비글여친""|""비글커플""|""설레는 영상""|""커플 데이트 영상""|""비글커플 데이트""|""성수커플""|""S.S Couple""|""잔소리""|""남자친구 잔소리""|""여자친구 잔소리""|""남친 잔소리""|""여친 잔소리""|""만우절""|""만우절 장난""|""남친 만우절""|""여친 만우절""|""남자친구 만우절""|""여자친구 만우절""|""남친 장난""|""여친 장난""|""짖궂은 장난""|""화해""|""연인 화해""|""커플 화해""|""연인 화해하는법""|""커플 화해하는법""|""연인 싸웠을 때""|""커플 싸웠을 때""|""잔소리 많은 남자친구""|""잔소리 많은 남친""|""잔소리 많은 여자친구""|""잔소리 많은 여친""",257932,10112,81,1320,https://i.ytimg.com/vi/fj8Ul67aLgc/default.jpg,FALSE,FALSE,FALSE,"※ 성수커플의 영상을 재밌게 보셨다면 '좋아요'와'구독하기' 눌러주세요!\n- 성수커플 구독하기 : https://goo.gl/PEMyUR\n\n이성현 : 대놓고 카메라 켜놓길래 뭘 찍나 했더니 이런거였구나..★\n이수은 : 미안해,,ㅎ  하지만 과도한 잔소리는 이제 그만~!\n\nHello Welcome to the SeongSuCouple Channel\nThank you for watching our video.\nPlease press subscription button and Like button if you enjoyed the video !\nPlease watch us many times.\n----------------------------------------------------------------------------\nCouple Facebook - https://www.facebook.com/holywatercouple\n\n◆이수은 Facebook - https://www.facebook.com/babyHeu5?fref=ts\n◇이수은 Instagram - h_ue_\n\n◆이성현 Facebook - https://www.facebook.com/lsh1498\n◇이성현 Instagram - LSH1498\n----------------------------------------------------------------------------\n▣ 기타 문의는 아래 메일로 보내주세요!\n- 메일 : zakill1498@naver.com"
J7LZDFN7jLE,17.15.11,[김재환] 의도치 않았던 재환이의 신곡 스포....,강깽이 강깽이,24,2017-11-13T14:36:00.000Z,"워너원|""김재환""|""재환""|""째니""|""워너원 뷰티풀""|""wanna one beautiful""|""wanna one beautiful chro""",15897,447,0,31,https://i.ytimg.com/vi/J7LZDFN7jLE/default.jpg,FALSE,FALSE,FALSE,오늘 재환이가 했던 스포의 정체를 알게 되었네요 ㅋㅋㅋ\n귀여워 째니........
ioC0-wmjbkI,17.15.11,쟤가 예뻐 내가 예뻐? 남순이 이상형에 폭풍질투하는 서윤?!ㅋㅋ/171113 │ 남순 #7,Namsoon 남순,22,2017-11-14T08:30:29.000Z,"댄스|""cover""|""여캠""|""리액션""|""오빠야""|""이설""|""김이브님""|""윰댕""|""박가린""|""쏘님""|""화정""|""이슬이""|""아콩""|""채원""|""고두림""|""셀리""|""지여닝""|""도아""|""꽃님""|""직캠""|""은솔""|""밤비노""|""나래""|""타미미""|""사나""|""쯔위""|""핫빈""|""아리샤""|""지효""|""외질혜""|""지혜""|""태리""|""아윤""|""안나""|""지유""|""윤마""|""유은""|""서윤""|""코코""|""핸콕""|""엣지""|""쪼꼬북""|""히봉""|""필메""|""꽃빈""|""러너""|""꽃자""|""채림""|""감스트""|""철구""|""태림""|""창현""|""햄튜브""|""망가녀""|""소근커플""|""딩고""|""딩고스튜디오""|""떵개""|""밴쯔""|""asmr""|""이사배""|""디바제시카""|""버블디아""|""노래하는코트""|""인범""|""신태일""|""김윤태""|""푸워""|""로이조""|""로이설""|""유소나""|""랜딩""|""악어""|""양띵""|""꿀꿀선아""|""남아공""|""남아존""|""인아쨩""|""염보성""|""인기동영상""|""김레인""|""양팡""|""윽박""|""최고다윽박""|""봉준""|""와꾸대장봉준""|""채보미""|""최군""|""거리노래방""|""JFla""",99508,317,25,137,https://i.ytimg.com/vi/ioC0-wmjbkI/default.jpg,FALSE,FALSE,FALSE,아프리카TV 방송국♥ http://afreecatv.com/wnnw\n인스타그램 팔로우♥ wnnw2\n페이스북 팔로우♥ 남순(박현우)\n아프리카/유튜브 광고문의 ☞ vm222@naver.com\n★편집요청 문의 ☞ 플러스톡 @남순/ sullena@naver.com
9kCzPCoPP2U,17.15.11,"백반토론 나는 짐이다 171114(화) 9595쇼 ‘세상은 넓고, 조세회피처도 많죠?'",비디오세상만사,25,2017-11-14T04:47:11.000Z,"9595쇼|""백반토론""|""9595쇼 백반토론""|""배칠수 전영미 9595쇼""|""배칠수 전영미 백반토론""|""백반토론 풀버전""|""백반토론 다시듣기""|""9595쇼 다시듣기""|""주간모음""|""9595쇼 주간모음""|""백반토론 주간모음""|""김현정의 뉴스쇼""",29330,276,9,27,https://i.ytimg.com/vi/9kCzPCoPP2U/default.jpg,FALSE,FALSE,FALSE,"성대모사: 박근혜, 이명박, 전시녀. 배논객."
HmCt4-HNRDY,17.15.11,"[뉴스를 쪼다] 문재인 압박받는 이명박, '노무현'으로 반격? 640만불, 논두렁 시계로 반격?",조선일보 Video C,25,2017-11-13T11:05:14.000Z,"뉴스를쪼다|""이명박""",39955,114,86,111,https://i.ytimg.com/vi/HmCt4-HNRDY/default.jpg,FALSE,FALSE,FALSE,"문재인 압박받는 이명박 전 대통령, '노무현 카드'로 반격에 나설까. 이명박은 '노무현의  640만불 수수, 논두렁 시계' 증거로 반격에 나설까?                   \n\n이명박 전 대통령이 12일 공항에서 기자들 앞에 섰다. “지난 6개월간 적폐 청산을 보면서 이것이 과연 개혁이냐, 감정풀이냐, 정치 보복이냐는 의심이 들기 시작했다며 우리가 외교·안보 위기를 맞고 있는 가운데 군·정보기관이 무차별적이고 불공정하게 다뤄지는 것은 우리 안보를 더욱 위태롭게 만들고 국론을 분열시킨다”고 했다.\n\n이 전 대통령의 발언 이후 미묘한 얘기도 나왔다. “노무현 정부와 관련해서 우리도 할 얘기가 꽤 있다.”\n\n전전 대통령을 둘러싼 ‘적폐’ 논쟁. 어디까지 갈까. 그리고 반격에 나선 MB쪽은 대체 어떤 패를 쥐고 있을까. \n\n조선닷컴 ‘뉴스를 쪼다’는 이제 막 시작한 본격 전쟁을 짚었다. \n\n“검찰에서는 이명박 전 대통령에 대해 몇가지 혐의를 말하고 있습니다. 국정원과 군 사이버사령부의 정치 댓글, MBC, KBS에 블랙리스트 하달, 고 김대중 대통령 노벨평화상 취소 운동 지시 같은 것들이지요.” \n\n“진짜 ‘혐의’는 빠진 것 같은데요. ‘노무현을 검찰 수사해 결국 자살에 이르게 한 죄’ 아닌가요. 아마 이 수사를 하는 사람들도, 이 수사의 대상자들도 그렇게 판단하고 있는 것 아닐까요.” \n\n“이명박 대통령이 ‘정치보복, 감정풀이’라는 용어를 썼는데, 우리 말에 ‘감정풀이’라는 말은 없어요. 한풀이라는 말을 하고 싶었게죠. 우리는 이미 이명박이라는 이름이 나오는 순간부터 이 드라마가 어찌 돌아갈지 다 알고 있지 않았습니까. 다만 법치국가니까 그게 걸맞은 법적 근거를 찾는 중이지요.” \n\n“이명박 전 대통령의 공항 인터뷰는 좀 실망스러웠습니다. 지금 상황을 영화적으로 보자면, 성문을 밀고 들어섰더니 모든 병사가 갑옷을 입고 활을 겨누고 있는 그런 긴장된 상황입니다. 이 때 드디어 한마디를 꺼냅니다. 당당하게 해야 합니다. 그러나 이명박 전 대통령은  ‘안보가 위태롭다’ 이런 안보공세로 수사를 그냥 덮으려는 것처럼 말하고 있습니다. 사이버사령부 인원을 증원한 것은 그 2012년에 북한의 대대적인 디도스 공격이후였습니다. “정책적 판단으로 그렇게 했다. 그 과정에 내가 정치적으로 불법간여했다는 것이 나온다면 책임지겠다. 그러나 한풀이로 이런 식으로 접근한다면 정당하지 않다’ 당당히 말 했어야 합니다. 대한민국 대통령이었으니까요.” \n\n“이 전대통령 측에서 ‘노무현 정부에 대해서 꽤 할 말이 있다’고 했습니다. 이게 그저 허풍은 아닐 겁니다. 640만달러, 3만달러짜리 피아제 시계 이런 것들을 일반에 흘리는 과정에서 문제가 됐던 것이지 팩트 자체는 사실입니다. 아마도 국정원에서는 노 전 대통령 딸의 집을 구입하기 위해 환전한 내용 등을 다 파악했을 겁니다. 당시 수사가 대대적이어서 검찰에 소환된 인물이 많았으니까요. 서면이나 녹음, 영상 등 많은 자료를 갖고 있겠지요.”\n\n“그러나 검찰 자료는 이명박 측, 혹은 야권 측에 대선주자가 있을 때 나올 겁니다. 그게 나온다해도 맞서 싸울 ‘친이계’라는 게 별로 존재하지 않지요.”\n\n“이명박 대통령을 구속, 수감하거나 실형을 살게하면 우리나라는 ‘전직 대통령 두명이 감옥에 있는 나라’가 됩니다. 친박과 친이는 ‘친노계’보다 더 서로를 싫어했던 사이인데요.”\n\n“보수정권이 진보정권에게 패한 데는 친박과 친이의 증오심이 한 몫 했습니다.”"
9r5ncSsv59I,17.15.11,"손흥민, 차범근이 부르자 말없이 안겨서 울다!!! 차붐도 덩달어 코끝이 빨개집니다",Sports Highlights,17,2017-11-11T01:34:22.000Z,"차범근|""대한민국 콜롬비아""|""한국 콜롬비아""|""축구""|""평가전""|""국가대표""|""손흥민""|""분데스리가""|""기성용""|""이청용""|""김남일""|""차두리""|""이영표""|""박지성""|""하메스""|""로드리게스""|""고요한""|""월드컵""",335188,1094,40,323,https://i.ytimg.com/vi/9r5ncSsv59I/default.jpg,FALSE,FALSE,FALSE,설명
bee6yrxaF3M,17.15.11,나가지 말라고 아련하게 야옹하는 고양이,크림히어로즈,15,2017-11-14T08:00:01.000Z,"고양이|""새끼 고양이""|""목욕""|""발톱""|""먹방""|""먼치킨""|""노르웨이숲""|""엑조틱""|""집사""|""cat""|""kitten""|""猫""|""ねこ""|""스코티쉬 폴드""|""마중""|""사냥""|""영양식""",156481,4929,32,767,https://i.ytimg.com/vi/bee6yrxaF3M/default.jpg,FALSE,FALSE,FALSE,"집사가 밖에 나가려고 하면 항상 티티 고양이가 문 앞까지 따라 나와요.\n집에 돌아가도 항상 티티 고양이가 문 앞에서 집사를 기다리고 있어요.\n그래서 밖에 나갈 때마다 집사만을 기다리는 티티 고양이가 눈 앞에 아른거려서 집에 빨리 돌아가고 싶어요.\n\n일곱 고양이와 집사의 애정 넘치는 이야기\n\n♥ 고양이 케어\n일곱 고양이들을 케어하며 일어나는 사랑스러운 전쟁\n울버린으로 변신하는 고양이 발톱깎기, 무사히 마칠 수 있을까?\n\n♥ 고양이를 위한 요리\n신선한 재료로 집사가 직접 요리를 만들어 주는 고품격 미식회\n오늘은 고양이들이 맛있게 먹어 줄까?\n\n일곱 고양이와 함께하는 행복한 이야기\n\n구독하고 일곱 고양이의 랜선집사가 되어주세요.\n일상을 더 행복하고 재미있게 만들어줄 고양이 영웅들이 매일 저녁 여러분을 찾아갑니다.\n\nBGM\n\nFive Card Shuffle Kevin MacLeod (incompetech.com)\nLicensed under Creative Commons: By Attribution 3.0 License\nhttp://creativecommons.org/licenses/by/3.0/\n\nYou’re free to use this song in any of your videos, but you must include the following in your video description:\nGreen Leaves by Audionautix is licensed under a Creative Commons Attribution license (https://creativecommons.org/licenses/by/4.0/)\nArtist: http://audionautix.com/\n\nYou’re free to use this song in any of your videos, but you must include the following in your video description:\nPrelude No. 16 by Chris Zabriskie is licensed under a Creative Commons Attribution license (https://creativecommons.org/licenses/by/4.0/)\nSource: http://chriszabriskie.com/preludes/\nArtist: http://chriszabriskie.com/\n\nMontauk Point Kevin MacLeod (incompetech.com)\nLicensed under Creative Commons: By Attribution 3.0 License\nhttp://creativecommons.org/licenses/by/3.0/"
OZ73fwBPzxU,17.15.11,효과적으로 다크서클을 없애는 7가지 방법 - Be Healthy,BE HEALTHY,26,2017-06-07T14:36:00.000Z,"다크서클|""음식""|""없애는 방법""|""방법""|""자기계발""|""화장""|""휴식""|""마사지""",14178,6,0,2,https://i.ytimg.com/vi/OZ73fwBPzxU/default.jpg,FALSE,FALSE,FALSE,나이들어보이게 하는 주범인 다크써클 \n\n어떻게 하면 효과적으로 없앨 수 있을까요?\n\n7가지 꿀팁 대 방출!
DQJp8uoRSXk,17.15.11,17년11월13일 APEC에서도 외톨이 문재인(포토타임.환영만찬),나라애 tv,22,2017-11-13T00:49:55.000Z,"APEC|""APEC SUMMIT2017""",111133,3143,439,933,https://i.ytimg.com/vi/DQJp8uoRSXk/default.jpg,FALSE,FALSE,FALSE,통역없이는 의사소통안되니..보는 사람으로하여금 무척 지루하겠다는 생각.환영만찬장에서는 아베 옆에 앉아있는 문재인부부 앵글조차 안잡아주는...언제부터 대한민국의 국격이 이렇게 떨어졌나 싶을정도.
BOo4GnCfoEo,17.15.11,[TF영상] 성심병원 간호사 장기자랑 논란…키·체중 제한도 있어,thefact,24,2017-11-11T07:51:25.000Z,"성심병원|""한림대""|""간호사""|""장기자랑""",508548,429,278,1233,https://i.ytimg.com/vi/BOo4GnCfoEo/default.jpg,FALSE,FALSE,FALSE,수년간 이어져 온 성심병원 간호사 장기자랑 논란. 성심병원 일부 간호사들이 재단 체육대회에 동원돼 짧은 의상과 선정적인 춤을 추도록 강요받아 논란이 되고 있다.
YQ2lbAaw8SI,17.15.11,아는 형님 102회 예고편,JTBC Entertainment,24,2017-11-11T13:49:09.000Z,"JTBC|""제이티비씨""|""아는형님""|""백윤식""|""구하라""|""성동일""|""응답하라""|""카리스마""|""전학생""|""강호동""|""이수근""|""이상민""|""김영철""|""서장훈""|""민경훈""|""김희철""",449629,1877,81,383,https://i.ytimg.com/vi/YQ2lbAaw8SI/default.jpg,FALSE,FALSE,FALSE,'응답하라 아는 형님'\n\n하라네 하숙집에 빈 방이 나왔다!\n소식 듣고 몰려든 일곱 남자들\n하라 남편 자리 넘보는 지원자들\n어디로 튈지 모르는 하라 마음♡\n\n역대급 깜짝 전학생 백윤식!\n형님들을 압도하는 카리스마\n니들 다 피x 싼다?\n\n'예능과 영화는 종이 한 장 차이'\n[아는 형님] 11월 18일 토요일 저녁 8시 50분! 본방사수★\n\nPlease enter subtitle of this video in your own language. \nAnybody can enter subtitle by referring to existing English subtitle.\nYou can make viewers all over the world pleased with your subtitle.\nPlease click below link if you are interested in participating with subtitle.\n\nJTBC Youtube channel communicating with fans faster\nView more videos & informations ☞\n\n▶ official     : http://www.jtbc.co.kr\n▶ youtube   : http://www.youtube.com/jtbcentertainment\n▶ facebook : https://www.facebook.com/JTBClove\n▶ twitter     : https://twitter.com/jtbclove
8heoVhxBB6o,17.15.11,홍대 머리채 실제 영상,길라임TV,24,2017-11-14T01:42:38.000Z,[none],24402,12,37,36,https://i.ytimg.com/vi/8heoVhxBB6o/default.jpg,FALSE,FALSE,FALSE,좋아요와 구독하기 부탁드립니다.
Rp3sh8tZisA,17.15.11,눈앞에서 사라지게 하는 마술인척! 몰카를 해보았다! ㅋㅋㅋ 반응 대박! - 니키,니키 NICKY,24,2017-11-14T10:00:03.000Z,"마술|""마법""|""니키""|""니키양""|""매직""|""nicky""|""마술사""|""이은결""|""최현우""|""해법""|""카드""|""도구""|""동전""|""트릭""|""magic""|""magician""|""trick""|""학예회""|""인기""|""신기""|""놀라운""|""신기한""|""초능력""|""염력""|""속임수""|""사기""|""도박""|""장난""|""장난감""|""몰카""|""리뷰""|""창의적인""|""창의력""|""휴지""|""크리넥스""|""휴지 없애기""|""바보""|""바보 만들기""|""티슈""",21563,440,10,163,https://i.ytimg.com/vi/Rp3sh8tZisA/default.jpg,FALSE,FALSE,FALSE,"휴지로 몰카를 하는 쉽고 좋은 방법! 여러분들이 당하면 안속을 것 같죠? 하지만 모르면 속게 된다는거!ㅋㅋㅋㅋㅋㅋㅋ\n\n[니키 NICKY] 구독하기▶ https://goo.gl/Ac7ZAw ☆\n\n▶ 구독 & 좋아요 & 덧글 & 공유는 니키양에게 큰 힘이 됩니다! \n\n[니키 NICKY] 채널을 소개합니다!\n▶ 안녕하세요, 마술사 니키양입니다! 마술, 신기하지만 어렵고, 베일에 싸여있는 마술의 인식을 여러분들과 함께 즐길 수 있는 놀이이자 취미로! 일생생활을 바꾸는 새로운 재미로 만드는 니키양의 마술 전문 채널입니다. 함께 즐겨볼까요?\n\n니키 채널에서 다루고 있는 콘텐츠는~ \n\n영상을 통해 시청자분에게 직접 보여주는 “마술”! \n\n마술인지 CG인지 맞춰보는 “Magic or CG“!\n\n실생활용 쉽고 재미있는 마술을 자세히 알려주는 “마술 해법 강의!” \n\n세상을 마술사의 눈으로 본다! “매직아이”! \n\n요리! 인형 뽑기! 색다른 도전! 니키의 다양한 모습을 보여주는 “니키TV”! \n\n마술 도구에 대해 설명해주는 “니키잇템”! 등 마술과 관련하여 다양한 주제로 제작된 영상들을 업로드하고 있습니다. \n\n전 국민이 마술을 취미로 즐길 그 날까지~ 함께해주세요! :)\n\n\n♠니키양's 팬사서함。 서울특별시 금천구 가산디지털로2로 98 (IT캐슬) 1동 213호\n♥니키양 공식 팬카페。 https://goo.gl/uPR2vE\n♣카카오톡 플러스 친구。 http://pf.kakao.com/_pypxhxl\n◆SOK ent. (니키매직스튜디오)로 문의하기(E-mail)。 sok-ent@nate.com\n\n\nCopyright 2017. SOK entertainment(NickyMagicStudio) All Rights Reserved.\n해당 영상의 저작권은 SOK엔터테인먼트(니키매직스튜디오)에게 있습니다. 이 영상을 공유하는 것은 가능하나 허가 없이 변경/배포는 불가합니다."
cCegqohCFQs,17.15.11,김국진 전 부인 이윤성 이혼 이유(사유),NHH Daily News Stories,22,2017-11-12T04:27:15.000Z,"nhhdailynewsstories|""UCZeyMmqsiIEGAAOs5tYQG4w""",141878,114,82,11,https://i.ytimg.com/vi/cCegqohCFQs/default.jpg,FALSE,FALSE,FALSE,김국진 전 부인 이윤성 이혼 이유(사유) \n\n[Subscribe My Channel]: https://goo.gl/UY2SGc
gK0h_7zAegA,17.15.11,“홍대 버스킹 보다가 머리채 잡힌 피해자입니다” (심경전문),korean stars,24,2017-11-14T02:08:14.000Z,스타,26693,55,19,50,https://i.ytimg.com/vi/gK0h_7zAegA/default.jpg,FALSE,FALSE,FALSE,"홍대에서 버스킹 공연을 하던 댄스팀에게 머리채를 잡혔던 피해자가 억울함을... [더보기] \nHashtag #KoreanStartNews \n#kpopNews2017 || \n+ 100.000 Subscribe, please. I really appreciate it! Please Click Subscribe or Click here: https://goo.gl/1FetSz for Korean start channel. \nFan page: https://goo.gl/Du8JWc \n+I do not own any images. For information on copyright infringement, please contact: cammy2017123@gmai.com \nSource: https://www.dispatch.co.kr/988410 \nI will always put your website backlink and recommend them here."
cRZP4QEgicU,17.15.11,[리본명장면] 초대 구름의 수호자의 무기 !! 히바리쿄야의 봉고레박스,금발로리트윈테일,1,2017-11-13T12:51:48.000Z,"애니메이션|""하치만""|""티비플""|""명장면""|""원피스""|""히키가야""|""소드아트온라인""|""동방프로젝트""|""일베""|""jtbc""|""내청춘""|""2분기""|""3분기""|""1분기""|""추천""|""직업""|""미소녀""|""애니추천""|""꿀잼애니""|""니코니코동화""|""보컬로이드""|""코노스바""|""아리우디""|""아라우디""|""이치고""|""만해""|""호로화""|""바쿠야""|""쿠로사키""|""팬텀""|""메이플스토리""|""잔저스""",57766,118,5,54,https://i.ytimg.com/vi/cRZP4QEgicU/default.jpg,FALSE,FALSE,FALSE,리본 192화
evGMWiEqTYM,17.15.11,빈라덴 잡은 바로 그 총! 흥국HK416D 205만원 제일비싼 장난감총,보겸 TV,24,2017-11-14T10:30:19.000Z,"클래시로얄;|""clash;""|""royale;""|""보겸;""|""보겸TV;""|""슈마상;""|""도티;""|""롤;""|""오버워치;""|""원피스;""|""모바일게임;""|""lol;""|""리그오브레전드;""|""포켓몬;""|""먹방;""|""클로얄;""|""overwatch""|""총""|""HK416""|""장난감""|""TOY""|""장난감총""",317155,23144,145,3070,https://i.ytimg.com/vi/evGMWiEqTYM/default.jpg,FALSE,FALSE,FALSE,보겸TV 유튜브 구독하기 :: https://goo.gl/08r0gG\n보겸TV의 달달한 영상을 바로바로 시청하시려면 구독은 필수!\n광고&섭외 문의는 bokyem123@naver.com로 문의주세요.\n\n보겸이의 오버워치 영상 모음 :: https://goo.gl/tSbgv0\n보겸이의 롤 하이라이트 모음 :: http://goo.gl/It3CHa\n보겸이의 원피스 대백과사전 모음 ::  http://goo.gl/Psk9Uq\n보겸이의 클래시로얄(Clash Royale) 모음 :: https://goo.gl/7wFF3D\n보겸이 아프리카TV 방송국 :: http://afreeca.com/bokyem123\n보겸이 페이스북 친추 :: https://www.facebook.com/gbk123456\n다양한 콘텐츠로 여러분을 찾아 뵙겠습니다!
FT0jBSkCqjQ,17.15.11,[겁 없는 녀석들] 한반도 최고 허세남의 최후는?,ROAD FIGHTING CHAMPIONSHIP,17,2017-11-11T16:39:52.000Z,[none],225648,222,98,246,https://i.ytimg.com/vi/FT0jBSkCqjQ/default.jpg,FALSE,FALSE,FALSE,[겁 없는 녀석들] 한반도 최고 허세남의 최후는?
